rule key,start line,end line,severity,message,type
java:S127,660,660,MAJOR,Refactor the code in order to not assign to this loop counter from within the loop body.,CODE_SMELL
java:S3077,216,216,MINOR,Use an "AtomicReferenceArray" instead.,BUG
java:S1124,398,398,MINOR,Reorder the modifiers to comply with the Java Language Specification.,CODE_SMELL
java:S1133,520,520,INFO,Do not forget to remove this deprecated code someday.,CODE_SMELL
java:S1874,527,527,MINOR,Remove this use of "isLoggable"; it is deprecated.,CODE_SMELL
java:S5998,591,591,MAJOR,Refactor this repetition that can lead to a stack overflow for large inputs.,BUG
